repo,owner,issue,problem,risks,resolution,preventative
retrofit,square,1," The build fails due to missing test directories in the core/src-tests and io/src-tests, which were ignored by git. "," The project can't be built which hampers development and testing processes."," The build was successful after creating the missing directories. Later, the build was mavenized with instructions provided in the readme for compilation."," To prevent this in the future, ensure that all necessary directories are properly included and not ignored by git. Also, the project has been mavenized to further streamline the build process."
retrofit,square,63," The Fetcher API reports progress as integers rather than floats, which can lead to imprecise progress updates especially in slow transfers."," This might result in a less optimal user experience as the progress update granularity is decided within the API and not by the UI, causing slower transfers to report the same percentage of progress even when they differ in actual data transferred."," The Fetcher API was removed."," No specific preventative measure was mentioned. However, a future solution could ensure that UI decisions are not made within the API, and progress reports are more granular."
retrofit,square,64," The ByteSink API in the Retrofit project is not symmetric with InputStream/OutputStream, causing confusion."," The mismatch may lead to misuse or misunderstanding of the API, potentially causing bugs in the system."," Not specified in the issue."," Not specified in the issue. Possible preventive measure could include ensuring that APIs are designed to match established patterns and conventions."
retrofit,square,65," The Fetcher Buffer Read is currently using '> -1' which is less precise and implies impossible scenarios."," This could lead to inaccurate data reading or even potential crashes if unhandled negative values are returned."," The comparison operator was changed to '!= -1' to be more precise and avoid impossible scenarios."," Further validation checks will be put in place to ensure only valid values are returned by read()."
retrofit,square,76," The main thread in the Retrofit project can just be an executor, leading to a lack of convenience API for Android's main thread."," This could lead to potential inefficiency and complications in the project execution on Android."," The problem was fixed with the merge of Pull Request #90."," No specific preventative measure mentioned, but regular code reviews and updates can prevent similar issues."
retrofit,square,78," The `Converter` is not determining how params not included in the URL get serialized into the request body."," Incorrect serialization could result in wrong data being sent in the request body, potentially leading to data corruption or other issues."," The specific resolution actions are not mentioned in the issue provided."," The specific preventative measures are not mentioned in the issue provided."
retrofit,square,79," The system uses hard-coded type for client and server errors which assumes responses in a specific format."," This could cause incorrect handling and interpretation of error responses which aren't in the assumed format."," The error handling was parameterized, similar to how Callback is already parameterized."," To prevent this in the future, avoid making assumptions about response formats and use parameterization or flexible handling methods."
retrofit,square,80," Inherited generic types in `RestAdapterTest` are ignored, which needs to be addressed."," Not addressing this could lead to inadequate testing and possible overlooked bugs in the inherited generic types."," The suggestion was to un-`@Ignore` the generic type test in `RestAdapterTest` and potentially flesh out the `Types` helpers using GSON or Guice helpers."," Implement regular testing of generic types and ensure they are not accidentally ignored in future updates."
retrofit,square,96," Retrofit library does not support HttpUrlConnection for Android versions 2.3 and higher."," This lack of support may discourage potential users from using the library."," A feature was implemented to allow support for HttpUrlConnection, as confirmed in pull request #136 and #159."," To prevent such issues in future, the maintainers decided to focus on actual REST implementation rather than supporting multiple clients. The library was designed to be client-agnostic to facilitate future support."
retrofit,square,101," NullPointerException is thrown when setExecutors in RestAdapter.Builder isn't called."," This issue can cause confusion and delays for users who do not understand why the NullPointerException is occurring."," A suggestion was made for a custom message to be added when a null HttpExecutor or CallbackExecutor is found. "," No clear preventative measures were discussed in this issue, but a more descriptive error message would help users to understand and rectify the problem quickly in the future."
retrofit,square,103," The RestAdapter in Retrofit does not support constant query string parameters, it only appends GET variables to an endpoint. "," Users have to manually include constant GET variables in every service call as a Named parameter, which is inefficient and prone to error. "," Users were guided to use the `@QueryParam` for constant variables. However, the `@QueryParam` was later removed in favour of including constants in the declared URL itself. "," For more effective coding, Retrofit should provide more documentation and examples for users to avoid misusing or misunderstanding the functionalities. A full website with documentation is planned to be established for Retrofit."
retrofit,square,111," The user is not aware how to send a file to a server using the retrofit library. "," User dissatisfaction and possible lower adoption rates due to inadequate documentation and examples."," The team suggested looking at TypedBytes / TypedFile for file upload, and indicated that they would add a feature for specifying a 'File' as a parameter for upload. They also mentioned starting on a documentation website with examples."," A more comprehensive documentation with examples was promised to help guide users in the future, and to have a proper place for discussing non-issues."
retrofit,square,112," The system is not forcing UTF8 everywhere, causing potential inconsistencies or errors."," This issue could cause data corruption or misinterpretation if not addressed."," The resolution is to enforce UTF8 across the whole system."," To prevent this from occurring again, the system should be designed to blow up or alert the user if it's not in UTF8."
retrofit,square,113," The system is always appending a ""?"" to the end of URIs, even when there are no parameters to be appended. "," This issue could cause tests to fail and may lead to incorrect URIs, resulting in unsuccessful API calls."," A pull request (#115) was made to address this issue."," Regular unit testing and improved code review could help to prevent similar issues in the future."
retrofit,square,114," The Content-Type header is being sent more than once, causing issues with parsing the HTTP request on a node.js/Express server."," The application may fail to communicate properly with the server due to the duplication of headers."," The user identified the issue and sent a pull request for the fix (as seen in issue #116)."," No specific preventative measure mentioned, though the resolution implies that reviewing and accepting the pull request may solve the issue."
retrofit,square,117," ProGuard and Retrofit are incompatible, causing errors when trying to configure ProGuard."," The project could face potential security risks without the obfuscation and minimization ProGuard provides, or functionality issues due to the incompatibility."," Recommendations were given on how to properly configure ProGuard with Retrofit, including keeping everything in the library and specific configurations for different aspects of the application."," Users are advised to keep everything in each library until they are comfortable with tweaking and testing the values themselves. Also, maintaining proper documentation on proper ProGuard configuration for Retrofit is suggested."
retrofit,square,118," Retrofit doesn't allow default values for a parameter, specifically for POST requests."," This limitation might lead to more complex code or errors if developers do not handle missing parameters."," The issue was partially resolved by using `@QueryParam` for GET queries as suggested in issue #103. "," A solution for POST requests is yet to be found, developers are encouraged to follow updates on this issue at https://github.com/square/retrofit/issues/951."
retrofit,square,119," Retrofit doesn't support cancelling requests."," This limitation could cause unnecessary waiting time and resource wastage, negatively impacting user experience."," A new feature was suggested where a `RetrofitTask<T>` would be returned (which extends `FutureTask<T>`) that has a `setTag(Object)` method on it."," Future improvements should consider the flexibility and control over the requests, including the ability to cancel them."
dubbo,apache,5," Request to add kryo serialization implementation in Dubbo, noting concerns about its compatibility and stability."," The implementation of kryo could cause performance and compatibility issues."," A kryo extension was created and shared for reference."," Thorough testing and discussion on the compatibility and stability of kryo before implementation."
dubbo,apache,8," Startup scripts do not work on Mac due to the usage of 'ps -f' command, which is not compatible with Mac OS. "," This issue could hinder Mac users from using or contributing to the project, reducing its user base and potential contributions. "," The user 'newroc' suggested upgrading to version 2.5.3 where the issue has been resolved. However, 'zhangyijun' reported that the simple monitor is still not working."," Ensure compatibility with all operating systems when writing scripts, and thoroughly test all features in different environments before release."
dubbo,apache,9," Incomplete logs being generated by the AccessLogFilter when performing tests with ab."," This poses a risk to the ability to accurately track and monitor the system's activity, which is crucial for debugging and identifying potential issues."," The issue is still open, no resolution provided yet."," To avoid such problems in the future, rigorous testing of the logging system should be conducted to ensure it operates as expected under various conditions."
dubbo,apache,16," User inquiring if the dubbo supports RESTful or only supports SOAP webservice."," Lack of RESTful support might limit the use of the dubbo among developers preferring this style."," Another user suggested an open source dubbox that supports RESTful developed based on dubbo."," No preventative measure was taken as this issue seems more like an inquiry rather than a technical problem."
dubbo,apache,17," Users are unable to switch from log4j to logback in the Apache Dubbo project, causing inconsistencies in logging across projects."," The logging inconsistencies could lead to difficulties in debugging and potential loss of important log information."," The Apache Dubbo team considered adopting slf4j as the standard log framework to address the issue."," By standardizing the log framework across the project to slf4j, future logging conflicts can be prevented."
dubbo,apache,19," Hessian protocol cannot pass RpcContext attachments transparently."," This could potentially disrupt the functioning of all protocols based on HTTP, impacting system-wide communication."," Issue was reviewed and considered by diecui1202 with a proposed solution found at https://github.com/apache/incubator-dubbo/pull/1801."," No preventative measure mentioned."
dubbo,apache,20," The document links (both English and Chinese versions) are not working."," This could prevent users from accessing important project information, potentially discouraging new contributors or frustrating current users."," The issue was addressed by providing an offline version of the document and later moving the documents to GitHub wiki."," To avoid a similar issue in the future, it's suggested to maintain and regularly check the document links to ensure they are active."
dubbo,apache,21," Maven dependency 'opensesame' cannot be found or downloaded, causing the dubbo project to fail during compilation."," The project could be delayed or failed if the required dependency 'opensesame' cannot be obtained."," Users were advised to manually download 'opensesame' from GitHub and install it locally. A user also uploaded the 'opensesame' pom to a central repository for others to access."," To avoid such issues, all necessary dependencies should be readily available and properly documented. As a long-term solution, the team plans to upload all essential dependencies to a central repository for easier access."
dubbo,apache,22,,,,
dubbo,apache,23,,,,
dubbo,apache,24," The open-source site was taken down due to security issues, causing missing package compilation."," The project may face a halt or delay in development due to missing packages for compiling."," Temporary solutions have been provided and the code was either reactivated in the Alibaba cloud sales environment or the documents were converted to md format and permanently migrated to GitHub."," The problem has been resolved on the master branch and will likely have implemented measures to ensure security issues do not cause the same problem in the future."
dubbo,apache,26," The user was unable to compile the source code due to a missing hessian-lite.3.2.1-fixed-2.jar file."," The project may not be built or run correctly without the required file, causing delays in development and testing."," The missing file was found in the alibaba-dubbo-dependency.zip and was downloaded and unzipped to the local maven repository. Another user also suggested removing the problematic code and skipping the test."," Ensure all dependencies are included in the project repository to prevent similar issues in the future. An update was made to the master branch to rectify this issue."
dubbo,apache,27," Users are unable to successfully compile due to missing packages and inaccessible internal repository links in the Apache Dubbo project."," The project's usability is at risk as potential users or contributors cannot build the project from the source code."," A team member suggested that the issue no longer exists in the master branch, implying that the problem was solved in later versions of the code."," No specific preventative measure was mentioned, but the issue indicates a need for better management of dependencies and ensuring their availability in public repositories."
dubbo,apache,29," User yhyhyhyh520 is requesting an offline address for the link provided. "," The risk to the project is minor, as this is a user support request rather than a technical issue with the codebase. "," Responded to the user's query providing necessary details or addressing the user's request. "," No preventative action needed as this is a user's request, not a system issue."
dubbo,apache,30," Build failure due to Maven dependencies on internal addresses."," Project cannot be built or updated, impeding progress and potential deployment."," Provided direct download links for the needed dependency packages and instructions to bypass unit tests during installation."," Suggested to publish all dependencies to the central repository to avoid similar issues in the future."
dubbo,apache,31," User is having difficulty connecting to dubbo's provider using a language other than Java."," This could limit the usability and accessibility of the software for users who are not familiar with Java."," No specific resolution is mentioned in the issue. "," Not applicable as this is a user's query rather than an identified bug or defect. Future documentation or guidelines could address this query."
dubbo,apache,32," Dubbo does not support JSON serialization when using the HTTP protocol."," This may limit the flexibility of data exchange and impact the compatibility with systems that use JSON."," Dubbo now supports fastjson, as indicated by a contributor."," No preventative measure has been mentioned, but regular updates and keeping track of new features in Dubbo can help users take advantage of the latest functionalities."
jadx,skylot,1," ArrayList variables in JADX are not showing their Generic type. "," Without clear display of Generic type, it could lead to confusion and potential errors during development."," The owner is currently developing a generic parser, which will address this issue in upcoming commits. "," Owner requests any potential parse errors to be reported to him for further refining the solution."
jadx,skylot,4," Complex 'if' statements are incorrectly compiled with removed 'return' instructions."," The application may behave incorrectly or crash due to the incorrect handling of complex 'if' statements."," Corrected the 'return' instructions removal in the `jadx.core.dex.visitors.regions.FinishRegions` module."," Improve code analysis to accurately handle 'return' statements in complex 'if' statements to prevent incorrect removal."
jadx,skylot,6," The ""Save all"" function in jadx-gui generates code that is different from the code displayed in the GUI, especially with incorrect method parameter names."," This discrepancy can lead to confusion and potential errors when developers use the saved code for further development or debugging."," The issue was not included in the text provided, so no resolution actions were given."," The issue was not included in the text provided, so no preventative measures were given."
jadx,skylot,8," The user encountered an OutOfMemoryError exception in the jadx project."," This could cause the jadx project to crash, impeding user experience and functionality."," The user was advised to reduce processing threads count or increase maximum java heap size. "," Future users should consider closing other programs and changing heap size if similar issues occur."
jadx,skylot,9," Decompiler providing incorrect results for certain code snippets."," The integrity of the decompiled code is compromised, potentially leading to misunderstanding or misuse of the code."," Developer has fixed the issues identified in the code snippets provided."," Continuous user feedback and diligent developer response to correct and improve the software."
jadx,skylot,10," Code not optimising class calls from 'classname' to 'this'."," The readability and manageability of the code might be affected, potentially slowing down development."," Implemented an optimization pass to replace 'classname' calls with 'this'."," No preventative measure mentioned. The issue was resolved as requested by the user."
jadx,skylot,12," Decompilation errors with complex 'if' and 'else' conditions."," Decompilation errors could result in incorrect code interpretation, affecting the reliability and accuracy of jadx."," Developer acknowledged the issue and was working on it. Further improvements were noticed by the user, although a minor issue in a very complex conditional in try/catch block remained."," Continue to refine and improve decompilation process, learn from other decompiler tools, and address any remaining bugs found in complex conditionals within try/catch blocks."
jadx,skylot,13," The user reported 'Missing block' and 'Inconsistent code' errors while decompiling Android frameworks with jadx version 0.5.2. "," Errors like these could affect the accuracy and reliability of the decompiled code, potentially misleading developers and causing bugs in their applications. "," The owner of the repository acknowledged the issue and made changes in a commit that resolved one of the problems identified by the user. "," To prevent similar issues in the future, more rigorous testing could be implemented before releases. Additionally, a review of the decompilation process might help identify any potential areas where these errors could arise."
jadx,skylot,15," Error in decompilation when a class contains a constructor with the same name as one of the class's methods. "," Incorrect decompilation of .dex files can lead to runtime errors and unexpected program behavior."," The issue was fixed by modifying the code handling the naming of methods during decompilation."," The issue was not anticipated by the developer as such naming was not expected, but moving forward, such cases will be handled correctly in the code."
jadx,skylot,18," Regression issue where merging nested 'if' statements is causing a breakdown in the region structure due to 'SKIP' flag being set prematurely."," This issue could prevent the correct decompilation of code, affecting the functionality of the jadx tool."," The problem was fixed by splitting the merge information calculation and additional actions after confirmation using a confirmMerge method."," There is a need for a transactional model with rollback support to avoid such issues in the future."
jadx,skylot,20," Lack of verification for the same object references in different registers in the Jadx codebase."," This issue could lead to object reference errors and data inconsistency, affecting the accuracy and reliability of the system."," The owner acknowledged the problem and mentioned that they have dealt with a similar issue in the past. They will apply a more common analysis to solve it."," The owner didn't explicitly state a preventative measure. However, implementing a mechanism to control where the reference to the object is located, as suggested by the issue reporter, could help prevent similar issues in the future."
jadx,skylot,21," The jadx tool is not decompiling a specific apk method (api.appgamefree.ftl.Application.attachBaseContext)."," The inability to decompile could lead to missing crucial information about the application, leading to incorrect analyses and errors."," The owner suggested using the `--show-bad-code` jadx argument to view decompiled code even with some errors, and the `--cfg` argument to generate control-flow graphs for each method to understand the code."," An explicit strategy was not mentioned, however, the owner planned to fix the issues related to incorrect try/catch processing, variable names assignment, and variable types detection."
jadx,skylot,24," The inability to rename class files, especially those without original names, causes difficulties in saving case-insensitive filenames on certain operating systems. "," This issue could impede the efficient use of jadx and make it incompatible with certain operating systems that have case-insensitive filenames. "," The issue requires a feature update which prioritizes targeting and renaming classes. "," Continuous updates and improvements should be made to the jadx program to accommodate various operating systems and their specific needs."
jadx,skylot,25," Decompilation errors persist in the latest unstable version of JADX."," Decompilation errors could lead to wrong outputs, rendering the tool unreliable and ineffective for its primary purpose."," The issue was not resolved in the provided context."," No preventative action was specified in the provided context."
jadx,skylot,26," The user is unable to decompile a specific method using jadx or any other java decompiler, encountering an inconsistent code error. "," This issue affects the usability of jadx and other java decompilers, potentially deterring users who encounter the same problem. "," The owner advised using the `--show-bad-code` command line option to view the method code, albeit without 'finally' blocks as jadx doesn't fully support these yet. "," While there doesn't appear to be a preventative action in this case due to the inherent limitations of jadx and similar tools, users can use the workaround suggested to view method code as much as possible."
jadx,skylot,27," The JADX decompiler fails to properly decompile small dex methods from a particular apk packer, resulting in an UnsupportedOperationException."," The decompiler's ability to handle all types of dex files is compromised, potentially limiting its overall effectiveness and usability."," The issue was closed without a direct resolution as the APK links provided for replication of the problem were no longer functional. "," No preventative measures were discussed or implemented due to the inability to replicate the problem."
jadx,skylot,31," There is a bug with the complex if/else condition and for loop in the Main class of the jadx project."," This bug could potentially break the functionality of the findPoint method, affecting the performance of the entire application."," The issue was identified and a simple test case was created to reproduce it, but the actual resolution actions were not provided in the issue content."," No preventative measures were mentioned in the issue content."
jadx,skylot,32," ""Try/catch wrap count limit reached"" exception is generated for some methods when certain apk is run with --show-bad-code."," The issue could result in faulty application behaviour and potential crash, which could affect user experience."," The problematic classes were successfully decompiled using an SDK found by another contributor."," The underlying causes of the exceptions need to be examined and addressed to prevent similar issues in future."
