repo,owner,issue,problem,risks,resolution,preventative
arthas,alibaba,15," Issues with the arthas web console functionality, including difficulties in setting the websocket port, problems with web console deployment and connection errors. "," Functional challenges and user difficulties could lead to reduced project usability and accessibility, resulting in user dissatisfaction. "," The project owner provided solutions and clarifications to the users' issues, including advice on port configuration and guidance on using the web console. Support for tunnel server was implemented for easier management."," Ongoing user support and project enhancements based on user feedback can help to prevent similar issues. Providing comprehensive documentation and usage instructions can also mitigate user difficulties."
arthas,alibaba,16," Request for jad command modification and auto-reload of modified class."," Modifying the jad command might lead to unexpected behaviour of the system."," The suggestion to use redefine command was made for loading the modified classes instead of modifying the jad command."," Continued adherence to using proper commands for respective functions to avoid system malfunctions."
arthas,alibaba,17," The user is requesting that the ""tt"" command results in Arthas be persisted to help verify bug fixes after code has been adjusted and re-published."," Not being able to persist the ""tt"" command results could limit the ability to compare different versions and timelines, potentially leading to unresolved bugs."," The maintainer responded that they are not considering support for persistence due to potential challenges with serialization/deserialization and the potential that the scene may not remain the same."," No specific preventative measure was mentioned, but the dialogue suggests there's a need for further discussion or feature development to support the user's request for persistence."
arthas,alibaba,19," The unit test for the 'arthas' repository needs improvement."," This issue may lead to inaccurate test results, affecting the reliability and quality of the project."," Improve the unit test to ensure accurate and reliable results."," Implement a regular review and update process for the unit tests to maintain their effectiveness."
arthas,alibaba,20," Uncertainty about what is causing unexpected process exits or garbage collection."," Unidentified issues could lead to unstable system behaviour and performance degradation."," Utilised Arthas to identify who was calling 'System.gc/System.exit'. A 'Btrace' script was used initially, but the post explains how to use Arthas for more effective troubleshooting."," Recommended to use Arthas in batch mode with a script to automatically identify these issues in future. They also suggested use of 'nohup' or terminal emulators like 'screen' or 'tmux' to keep the process running in the background, even if the SSH session is terminated."
arthas,alibaba,21," The data feedback feature is disallowed due to lack of a suitable server and concerns over collecting external user information without their consent."," User privacy issues could arise and the project could lose user trust if external user information is collected without consent."," Consideration to add an option in the future that allows users to configure the data feedback feature if a server is deployed."," Ensuring user consent before collecting their information and implementing user-configurable settings for the data feedback feature."
AndroidUtilCode,Blankj,1," The .md file is displaying garbled text when viewed on mobile through GitHub."," The issue may hinder user readability and accessibility to the code, potentially deterring collaboration."," The encoding was changed to UTF8 without BOM to solve the issue of garbled text when viewed on mobile devices."," The maintainer plans to consolidate the code into several utils classes and incorporate them into their Android development framework to prevent similar issues in the future."
AndroidUtilCode,Blankj,4," The issue pertains to a request for a summary of audio and video related interface documentation in the AndroidUtilCode repository."," Without proper documentation, other contributors may find it difficult to understand, modify, or use the audio and video interfaces, which could slow down development or lead to errors."," User DyncLang provided a link to a demo for reference."," To avoid such issues in the future, it would be beneficial to ensure that all interfaces and functions are well-documented at the time of their creation."
AndroidUtilCode,Blankj,6," The MD5 encryption was not working as expected. The algorithm provided different results compared to other encryption methods used before. "," Incorrect encryption could lead to data security issues and loss of data integrity. "," The issue was resolved by adjusting the hexadecimal conversion in the MD5 encryption algorithm. "," The MD5 algorithm was further optimized and tested with larger data sets to ensure accuracy and consistency. A feature to perform null-checks was removed, leaving that responsibility to the user. A 'salt' feature was also added to the encryption process for added security."
AndroidUtilCode,Blankj,8," The existing solution does not perfectly adapt to layouts with SurfaceView, the screenshot's background is black."," The quality of the project could be compromised if screenshots cannot be taken correctly."," The issue owner suggested to search for similar issues online, as the solution may vary depending on the specific case."," No specific preventative measures were discussed due to the potential need for case-specific solutions."
AndroidUtilCode,Blankj,11," The regular expression for validating mobile numbers is incorrect."," This may result in validation errors and misclassification of mobile numbers, impacting user input and data quality."," The owner, Blankj, updated the regular expression in the method ""isMobileNO"" for better validation."," Regular expressions should be thoroughly tested and regularly reviewed to ensure they are still valid and accurate."
AndroidUtilCode,Blankj,15," The code rendering in the ""Set Screen to Landscape"" section of the ""Screen Related"" document does not highlight Java."," Without proper highlighting, it could be harder for developers to understand and use the code."," None stated in the issue content."," Ensure that all future code snippets in documentation specify the correct language for proper highlighting."
AndroidUtilCode,Blankj,19," On Android 6.0, using DeviceUtil.getMacAddress returns 02:00:00:00:00:00"," Incorrect MAC address retrieval could lead to invalid device identification"," The method of obtaining the address via wlan0 was added "," No preventative measure mentioned."
AndroidUtilCode,Blankj,23," The issue discusses the need for a tool class for image processing, which is commonly used. "," Not having an image processing tool class could limit the functionality and usability of the project. "," There is no clear resolution mentioned in the issue, only a suggestion for adding an image processing tool class. "," A potential preventative measure could be to always consider commonly used features and tool classes during the planning and development stages of a project."
AndroidUtilCode,Blankj,24," Inefficiency and inflexibility in the SharedPreferences Singleton design pattern."," Inflexibility in name modification may slow down development and introduce bugs."," Decided against using a Singleton for SharedPreferences to ensure name modification flexibility."," Careful consideration of design patterns in future to ensure they suit the project's needs."
AndroidUtilCode,Blankj,30," The user requested the addition of SQLite CRUD operations to the utility class in the AndroidUtilCode repository."," The risk to the project is that SQLite CRUD operations are heavily tied to the model layer, which might not be suitable for extraction into a utility class."," An alternative was suggested to encapsulate the greenDAO CRUD operations into the utility class instead."," No preventative measures were mentioned as this was a feature request, not a problem with existing code."
AndroidUtilCode,Blankj,32," User requests a thread-related utility class."," Lack of multi-threading functionality could limit software performance and efficiency."," Provided a link to an existing ThreadPoolUtils in the repository."," Future requests should be directed towards existing tools before developing new features."
AndroidUtilCode,Blankj,34," The URL for PhoneUtils.java in the AndroidUtilCode repository is incorrect."," The incorrect URL could lead to confusion and prevent users from accessing the correct resource."," The owner acknowledged the issue."," No preventative action indicated."
AndroidUtilCode,Blankj,36," The user is asking why there isn't a ToastUtils in the project."," If there's a need for ToastUtils and it's not included, this could limit the functionality of the project."," This issue has not been resolved based on the discussion."," To prevent this kind of issue in the future, clear documentation about the included and excluded components in the project could be beneficial."
netty,netty,35," No specific problem mentioned as it's a test issue."," No risks to the project as it's a test issue."," No resolution required as it's a test issue."," No preventative measures needed as it's a test issue."
netty,netty,59," The `ChannelFuture` does not implement `java.util.concurrent.Future` which could simplify the code."," Possible compatibility issues in the current system if not properly implemented."," Normanmaurer took the task to implement `java.util.concurrent.Future` into `ChannelFuture`."," Ensuring all future similar classes implement necessary and simplifying methods from the start."
netty,netty,60," The Netty project needs to be split into multiple submodules as it is growing. "," Without this split, the project could become too unwieldy and difficult to manage, potentially slowing down development and making it more prone to errors."," A 'modularization' branch was created to test out the new structure, which involved creating separate JAR files and categories for different parts of the project. "," The project will continue to consider feedback and adapt the new structure as necessary to maintain a balance between modularization and fragmentation."
netty,netty,61," The project has redundant `@version` Javadoc tags, leftover from when the project used SVN, that need to be removed."," If not addressed, this may lead to confusion as the version tags are not relevant in a Git-based project."," A contributor, CruzBishop, removed the `@version` Javadoc tags from the 4.0 branch of the project."," No specific preventative measures were discussed, as the issue was a one-time cleanup associated with the transition from SVN to Git."
netty,netty,62," The project requires a high-performance direct/heap buffer pool, allowing users to shrink or limit pool size and provide stats for optimal size diagnosis. Non-pooled heap buffers should also be allowed for user convenience. Some users reported issues with memory overuse."," If not resolved, the performance of the project could be affected, and memory overuse could lead to system crashes or other issues."," Discussion and prototyping led to the implementation of the feature. The problem of memory overuse was addressed by suggesting the users to enable leak-detection and correctly release buffers back to the pool."," To prevent future issues, the team suggested enabling leak-detection and ensuring buffers are correctly released back to the pool. Users should also properly manage the rate of writing data to avoid flooding the system."
netty,netty,63," DynamicChannelBuffer's excessive memory consumption and copying due to its capacity doubling approach."," This could lead to inefficient use of memory resources and decrease the performance of applications using Netty."," The issue was fixed by introducing a new ensureWritableBytes() implementation which increases the capacity by 4 MiB at most."," To prevent this from happening again, the new implementation should be continuously reviewed and optimized based on usage patterns and performance metrics."
netty,netty,64," Netty 4 no longer needs to support JBoss Logging, which has opened up a discussion on what logging framework to use moving forward. The two candidates are `java.util.logging` and SLF4J, each with its pros and cons."," Depending on the chosen logging framework, it could introduce dependencies and potential configuration difficulties for novice users. Additionally, if not handled properly, different logging systems used by various projects could lead to incompatibility issues and crashes."," After considerable discussion, the decision was made to stick with the current logger API and modernize the existing layer."," To prevent such confusion in the future, it was decided to maintain the current logging system, ensuring no additional dependencies and configuration complexities for users."
netty,netty,65," The HashedWheelTimer lacks detailed statistics about the distribution of timeouts in the wheel, which could cause uneven allocation of items to slots. "," This could potentially lead to poor resource utilization and decreased performance if some slots end up with significantly more items than others."," The team discussed introducing a utility class for generating distribution stats for the timeouts. They considered using existing libraries like Yammer Metrics, but decided to keep the project dependency-free. The solution involved creating listeners/callbacks for updates, similar to Netty's logging abstraction layer. They also planned to provide stats for the deviation between scheduled and effective timer task execution time. "," In the future, the team could consider providing more comprehensive statistics and improving the existing metrics abstraction layer to support different metrics providers. They could also explore other open-source monitoring/metrics libraries for potential use."
netty,netty,68," Complexity of channel state event model in Netty with too many events for (dis)connection."," The project risks becoming unnecessarily complex, potentially confusing users."," Proposal to simplify model by replacing certain events (such as 'channelOpen', 'channelBound', and 'channelConnected') with new events ('channelAttached', 'channelActivated', 'channelDeactivated', 'channelDetached')."," Future developments should aim to maintain simplicity and clarity in the code and its operations."
netty,netty,69," The recursive execution logic in ChannelHandlers can cause various problems and may not provide the best user experience."," The issue could lead to unnecessary memory consumption and possibly too deep a stack."," The idea to provide different ways to send an event to the next handler was discussed, but ultimately the issue was closed as ""won't fix."""," The issue can be mitigated by ensuring that blocking operations don't mix poorly with the implementation and by flushing the thread's schedule prior to blocking."
netty,netty,71," No specific problem is mentioned in this GitHub issue. "," No particular risk is specified in this GitHub issue. "," No resolution steps are mentioned in this GitHub issue. "," No preventative measures are detailed in this GitHub issue."
netty,netty,72," QueryStringDecoder does not correctly parse field1=value1;field2=value2."," This could limit the functionality and compatibility of the software, as it fails to adhere to W3C recommendation of supporting semicolon separators."," Decided to preprocess by converting all semicolon separators to ampersand separators."," No specific preventative measure was discussed in this thread."
netty,netty,74," Potential infinite loop in NIO client socket boss thread."," The program could hang indefinitely, causing unresponsiveness and potential data loss."," Not provided in the given context."," Not provided in the given context."
netty,netty,77," Deadlock occurring in SslHandler."," Potential for system hang or slow performance due to deadlock."," Not provided in the issue content."," Not provided in the issue content."
netty,netty,78," The user must manually remove Channel instances from ChannelLocal when the Channel is closed, risking a potential leak."," The risk lies in potential memory leaks if the user forgets to manually remove closed Channel instances."," The proposal is to register a ChannelListener that automatically removes the Channel from ChannelLocal once the Channel is closed."," The prevention will be to make this automatic removal a configurable setting via a constructor."
netty,netty,79," The detection of ""suppressible events"" by SslHandler could break on different Operating Systems due to variations in OS Locale, JDK, etc."," This could potentially cause crashes or unexpected behavior in the application on certain systems (as observed on Ubuntu with German language)."," The issue was identified and posted for review, although no specific resolution steps were described in the provided content."," To prevent this, there needs to be a more robust method for detecting ""suppressible events"" that can accommodate variations in OS Locale, JDK, and other factors."
netty,netty,82," There was no way to validate that received messages are compliant with a specified Charset using ChannelBuffers in Netty."," Could lead to errors and inefficiencies in text-based protocols or protocols with text-based frames."," The issue was resolved by creating a feature to validate UTF-8 compliance in messages, as seen in this pull request: https://github.com/netty/netty/pull/5422"," Going forward, the introduced feature will validate compliance with UTF-8 in the received messages, preventing such issues."
zxing,zxing,21," The PDF 417 function in zxing needs to implement error correction."," The absence of error correction might lead to erroneous or inefficient data processing."," The contributor, angelnar87 proposed a change in the error correction algorithm to Berlekamp-Massey from the Euclidean algorithm, which seems to work well with errors and erasures."," The discussion pointed towards having good unit tests in place to detect whether the new error correction method is working. The project needs more test cases for error correction and especially for missing values."
zxing,zxing,22," Barcode Scanner is not properly implementing onSurfaceChanged(), potentially causing the camera to fail when handling rotations."," This could cause crashes and user dissatisfaction due to the malfunctioning camera in the barcode scanner."," The onSurfaceChanged() method needs to be implemented correctly to handle rotations and prevent camera failure."," Regular code reviews should be conducted to ensure all methods are implemented correctly and effectively."
zxing,zxing,25," The Android ContactsContract API is not properly supporting additional VCARD data like birthdays, anniversaries, websites, etc."," If not resolved, the app will lack functionalities of adding additional contact details, limiting the user experience."," Discussed the potential solution using the ContactsContract API and considered the possibility of using APIs with Intent for better functionality."," There isn't a direct preventive measure mentioned. However, the constant exploration and understanding of the Android API capabilities can help anticipate and prevent such issues in the future."
zxing,zxing,26," The EncodeHintType.MARGIN set to 4 is not being honored by AZTEC and DATA_MATRIX in zxing."," This could affect the correct rendering and reading of barcodes, potentially leading to incorrect or failed scans."," No resolution is provided in the issue."," To prevent this issue, a code review or testing process could be implemented to ensure all types of barcodes are correctly honouring the EncodeHintType.MARGIN."
zxing,zxing,28," The Writer API in the zxing project needs augmentation to allow for direct encoding of byte[], not just String."," This issue could potentially affect the functionality of the application by not supporting the encoding of byte[]. "," A patch was partially implemented to address this issue, however the full implementation was not done due to complexity and duplication issues. "," The proposed solution is to add new public API methods that accept a byte[] rather than a String as input, and to separate and cleanly implement the change."
zxing,zxing,29," QR code scanning is weaker when the code is rotated 45 degrees due to the heuristics assumptions."," Poor QR code recognition could lead to inaccurate data interpretation and user frustration."," Proposes to modify the TRY_HARDER mode to account for a rotation of 45 degrees just for QR codes."," Introduce regular testing at various QR code orientations to ensure robust recognition."
zxing,zxing,30," The PDF417 decoder is ignoring ECI segments."," Reduced functionality and compatibility with QR codes due to lack of ECI segment support."," Issue was recognised as a duplicate of issue #166 and hence was closed."," Avoid creating duplicate issues in the future by thoroughly checking existing issues before creating a new one."
zxing,zxing,31," Inability to delete multiple items from history at once and attach comments to them."," User dissatisfaction due to inefficient history management and lack of note-keeping features."," The feature needs to be developed and integrated into the software."," Implement a system for regular user feedback to understand and anticipate future user needs and expectations."
zxing,zxing,32," Lack of detailed metadata calculation from QR codes such as the number of errors corrected."," Insufficient information provided from QR codes could lead to inaccuracies and limited functionality."," The issue was moved from Google's code issue tracker to Github for further consideration."," Opened up to community contribution, encouraging pull requests that add additional metadata for QR codes."
zxing,zxing,33," Request to integrate the zxing project with Android's standard backup/restore system."," Without integration, users may lose their data when transitioning to a new device or re-installing the application."," The issue is reported but there is no mention of the actions taken to resolve the problem."," Not specified in the issue report."
zxing,zxing,34," The ITFReader in zxing cannot read ITF barcodes with a Wide To Narrow Ratio = 2, despite being able to read Code-39 with the same ratio."," This could limit the usability and compatibility of the zxing library, as it may not work properly with all ITF barcodes."," The issue was closed due to lack of follow-up from the reporter, no resolution was implemented."," No preventative measure mentioned due to no resolution action taken."
zxing,zxing,35," The IntentResult API does not include the ParsedResult, causing users to need to add a large, potentially unnecessary dependency to parse results."," This might discourage users from using the IntentResult API or lead them to unnecessarily bloat their project with the core.jar dependency."," The user suggests enhancing the IntentResult API to include the ParsedResult itself, reducing the need for the addition of the core.jar dependency."," The proposed preventative measure is a decision to be made on how to expose the ParsedResult and sub-classes to an Android app that uses IntentIntegrator, such as moving these classes to the android-integration module or a separate module."
zxing,zxing,37," The application throws a StringIndexOutOfBoundsException error when trying to parse an invalid UPC_E barcode with only one character."," This could potentially cause the application to crash, reducing user experience and functionality."," A developer responded to the issue, suggesting that an exception is expected in the case of invalid input such as a one-character UPC_E barcode. The parser shouldn't continue in such a scenario."," A potential solution to prevent the error is to add checks to ensure the validity of the barcode before parsing, such as confirming it has the necessary 8-digit condition."
zxing,zxing,41," Scanning part of a PDF417 barcode crashes the app with an ArrayIndexOutOfBoundsException."," This issue could impact user experience and app reliability, potentially causing users to abandon the app."," The bug was fixed in a new code commit."," Continuous testing and code reviews could prevent similar issues from occurring in the future."
zxing,zxing,44," Lack of a visual indicator in the Barcode Scanner app to show that additional info is being downloaded."," User confusion between waiting times and no additional info available, potentially leading to a decrease in user satisfaction."," Implement a feature to show a visual indicator during download of additional info in the Barcode Scanner app."," Regularly gather and respond to user feedback to enhance user interface and user experience."
zxing,zxing,45," VCard data from scanned QR is not being transferred to the Contact list in the Barcode Scanner."," User inconvenience, reduced functionality and user experience."," Clarified that the app's function is to open the Contacts app with a '+' button to add a new contact, not to pre-fill contact data."," Improved communication and clarification of the app's intended functionality to users."
spring-boot-demo,xkcoding,1," The issue lacks sufficient information to identify a specific problem."," There's no clear risk to the project as the issue doesn't specify a problem."," No resolution action was taken due to lack of specific problem details."," Improve issue submission guidelines to ensure clear, concise problem descriptions."
