repo,owner,issue,problem,risks,resolution,preventative
GitHub-Chinese-Top-Charts,GrowingGit,13," Request for inclusion of the ""AUXPI"" project in the GitHub-Chinese-Top-Charts, unaware it's already listed."," Miscommunication may lead to unnecessary redundancy in the list."," The owner clarified that the project is already listed as #27 in the Go category."," Clearer communication and checking of the existing list before making requests for inclusion."
GitHub-Chinese-Top-Charts,GrowingGit,15," The user suggests creating a simple page to store certain contents for easy collective access."," Limited content presentation on GitHub."," The owner suggests considering creating this on a separate platform in the future."," No preventative measure suggested as it is a new feature request, not a recurring issue."
GitHub-Chinese-Top-Charts,GrowingGit,17," The user howie6879 requested to have their Python asynchronous crawler framework 'Ruia' included in the 'GitHub-Chinese-Top-Charts' repository."," The risk to the project was potential exclusion of a high-quality framework due to lack of description in Chinese."," The owner, GrowingGit, asked the user to add a description in Chinese, which the user did. Afterwards, the framework was added to the Python list at #135."," In order to prevent this from happening again, users should be reminded to include descriptions in the necessary languages when submitting requests for inclusion."
GitHub-Chinese-Top-Charts,GrowingGit,18," The user requested for synchronization of project to Gitee (a Chinese Git platform) for easy starring."," Difficulty in accessing and starring the project due to regional restrictions or preferences."," The project owner has synchronized the project to Gitee as per the request."," Regularly update the project on both platforms to meet user needs and preferences."
GitHub-Chinese-Top-Charts,GrowingGit,20," The issue raised is that the GitHub-Chinese-Top-Charts project contains too many summary, learning, and non-original content projects that are not valuable or useful to users."," The project risks losing credibility and user engagement if it continues to include non-useful, non-original content."," The project owner responded by agreeing to separate such projects from the main list."," To prevent this issue from recurring, the project owner can ensure to include only original and useful projects in the list."
GitHub-Chinese-Top-Charts,GrowingGit,21," The issue is unclear but suggests a problem with the CSS ranking or categorization in the GitHub-Chinese-Top-Charts repository."," The risk is poor repository management and potential misinformation or confusion for users."," No resolution is provided within the issue content."," No preventative action is suggested within the issue content."
GitHub-Chinese-Top-Charts,GrowingGit,23," The issue is a suggestion to add a Vim script language leaderboard to the GitHub-Chinese-Top-Charts project."," The project might not be as comprehensive or useful to Vim script users if this suggestion is not implemented."," The owner of the project, GrowingGit, added the Vim script leaderboard as suggested."," No specific preventative measure is mentioned in this case as it was a suggestion for improvement rather than a problem."
spring-boot,spring-projects,8," Fresh clone leads to failures in the spring-boot module due to missing packages and symbols."," These failures disrupt the build process and could potentially delay project development."," Fix applied to the Continuous Integration (CI) server and verified that it builds locally."," Ongoing monitoring of CI server for early detection of similar issues."
spring-boot,spring-projects,14," User is having issues running 'mvn package' command due to missing src/main/java file."," Could potentially cause a delay in project completion."," User was advised to check if they have a .java file in src/main/java. User confirmed file was missing and added it. "," To avoid similar issues in future, the user should ensure that all necessary files are in their correct directories before running commands."
spring-boot,spring-projects,16," SpringApplication.run() sources do not recognize properties and wildcards in Spring Boot."," This could affect the migration of existing projects to Spring Boot and disrupt the loading of bean definitions."," The issue was addressed by a Pull Request (#17) that fixed the problem."," No preventative measures have been explicitly mentioned, however, future code reviews could focus on ensuring such issues do not recur."
spring-boot,spring-projects,19," The code sample for returning a Map<String,String> in Spring Boot - Actuator documentation does not work in either Groovy script nor Java app."," The problem could cause confusion and delay for developers using the Spring Boot - Actuator library."," The user had to add @Grab for the actuator in Groovy and use the correct dependencies in Java."," Developers should be mindful of the dependencies used in the project and consider updating the documentation to include information about necessary dependencies."
spring-boot,spring-projects,20," Spring-boot is using the deprecated spring-security-javaconfig instead of the updated spring-security-config."," The project may encounter future issues and lack support due to the use of deprecated software."," Updated the README with the correct information. "," Regularly review and update the project's dependencies to ensure they're current."
spring-boot,spring-projects,21," Incompatibility of Spring Boot with GVM due to non-compliance with zip file conventions. "," Spring Boot cannot be added to GVM, limiting its use and accessibility."," Misunderstanding was clarified and it was confirmed that the current Spring Boot zip file works fine with GVM."," Clearer communication and understanding of file conventions and requirements."
spring-boot,spring-projects,22," The download link for the binary distribution is broken and redirects to an unrelated website."," Users are unable to download the necessary software, impacting usability and potentially turning away users."," The correct URL was identified and updated in the README."," There is no explicit preventative measure mentioned, however, regular verification of download links could help prevent such issues."
spring-boot,spring-projects,26," The Banner implementation currently uses a Printstream, it would be beneficial if it also used a Log to appear in logfiles indicating when an application started."," The absence of this feature can cause confusion in determining the start of an application in the log files."," A new issue was opened to address the request of making the Banner implementation log to a Log file configurable."," This feature will be configurable, allowing users to choose between stdout and the Log file, providing flexibility and preventing future similar issues."
spring-boot,spring-projects,27," StartupInfoLogger only logs information on the Spring Boot and Spring Framework version. The versions of all used Spring portfolio products are not logged."," If different versions of Spring products are used, it can lead to incompatibility issues and can make debugging more difficult."," Decided not to implement the feature due to complexity concerns. The recommended solution is to use the '/info' endpoint and version control."," To keep track of versions used and to prevent potential compatibility issues, it is recommended to utilize version control and the '/info' endpoint."
spring-boot,spring-projects,31," In the spring-boot application, classpath properties files have more precedence than environment variables."," This could lead to incorrect configurations being loaded, causing potential functional or performance issues."," A change was pushed to fix the issue, alternatively users could use a local properties file to override values."," No specific preventative measure was mentioned in the issue thread. However, understanding and respecting the order of precedence for loading configurations could help prevent similar issues."
spring-boot,spring-projects,36," Adding spring-security 3.2.0.RC1 dependency to a Spring Boot application causes the application to crash on startup."," This issue can prevent the development and operation of applications requiring this particular security dependency, possibly leading to security risks if not properly managed."," The issue was resolved by either downgrading to spring-security version 3.1.4.RELEASE or using the spring-boot-starter-security to handle the dependency. Another workaround suggested was to exclude the SecurityAutoConfiguration using the @EnableAutoConfigure annotation."," To prevent this from happening again, the use of a starter pom was suggested for handling the versioning and dependencies of spring-security."
spring-boot,spring-projects,39," User had difficulty transitioning from an embedded version of an application to a deployment version, specifically with the auto-configuration for hsqldb autocreate not working in deployed mode."," If such issues are not addressed, it could hinder the application’s transition from development to production, potentially delaying project timelines or affecting the application’s functionality in the production environment."," A solution was provided to add initializers to match the behaviour of the `SpringApplication` in the non-embedded case and include the loading and binding to the `application.properties`. Also, it was suggested to add a `SpringBootServletInitializer` to ensure all features of `SpringApplication` are present in the web context."," To prevent similar issues, the user should ensure to include the necessary initializers when transitioning from an embedded to a deployment version of the application. Future project documentation can include explicit guidelines on this process."
spring-boot,spring-projects,40," BeanDefinitionLoader fails to load resources when LaunchedURLClassLoader is the current classloader, causing the application to crash on startup."," This issue potentially prevents the application from starting, hindering development and deployment processes."," The exact resolution isn't mentioned in the given content."," The exact preventative measures aren't mentioned in the given content."
spring-boot,spring-projects,42," The InMemoryMetricRepository is not thread-safe, leading to potential lost increments and Null Pointer Exceptions (NPEs)."," This concurrency issue could lead to inaccurate metrics, hindering the proper monitoring and performance evaluation of the project."," The issue was fixed, although the InMemory* implementations are not intended for GA."," A more robust solution or implementation is expected to replace the current InMemory* implementations to ensure thread safety and avoid such concurrency issues in the future."
spring-boot,spring-projects,43," The user is unable to hot redeploy when running through the main class in Gradle, and needs an equivalent of `$ mvn spring-boot:run` in the Gradle plugin. "," This issue affects the efficiency and workflow of development as changes made in the codebase cannot be seen immediately without rerunning the entire application. "," The issue was closed as the Spring team clarified that hotswapping changes in a running app is an IDE feature and not a Spring Boot issue. It was suggested to use the debug mode for hot-swapping code and spring-loaded for the command line."," There was no direct preventative measure taken as the problem was not seen as an issue of Spring Boot. However, a separate issue was opened to discuss further about reloading classes with spring-loaded."
spring-boot,spring-projects,44," Request for making all Conditions in Spring Boot public for easier reuse by developers."," Limited code reusability could slow down developer productivity."," Confirmed that all conditions are already public and suggested the potential move to Spring Core once feature set stabilizes."," To avoid similar confusion in the future, better communication and documentation about the accessibility of these features could be improved."
spring-boot,spring-projects,46," The Spring Boot application experiences inconsistent behavior due to variable platform encoding settings. The application should fail to start if JVM encoding settings are not UTF-8. "," The issue may cause unpredictable results for users and developers, affecting both development and production. It can lead to data corruption, application crashes, or incorrect functionality."," The solution implemented checks for the system property ""file.encoding"" and environmental variables ""LANG"" and ""LC_ALL"". If the encoding is not set to ""UTF-8"", an error message is generated and the application refuses to start."," To prevent similar issues, the recommendation is to implement a ""sanity check"" stage in the application startup process, where it is ensured that the application can run with the correct settings."
elasticsearch,elastic,1," Lack of support for terms filter in Query DSL which allows configuring more than one term for a specific field."," Limited functionality of Query DSL, affecting user experience and flexibility in data queries."," The terms filter was supported and the issue was closed with the commit bd2b0a632bfc5aabb408e7f47cfaa52a7d1b2b50."," No specific preventative measure mentioned. Future issues related to this could be mitigated by thorough testing of new functionalities."
elasticsearch,elastic,3," The system lacks JVM (Java Virtual Machine) level transport for simple testing and embedding of a single node."," Without this feature, testing and embedding of single nodes could be more complex and time-consuming."," The issue was resolved by adding a feature that allows for JVM level transport, which can be enabled in the system settings."," No specific preventative measures mentioned as this was a feature addition rather than a bug fix. Future feature testing should ensure this transport method continues to function as expected."
elasticsearch,elastic,4," The Elasticsearch project does not currently support geospatial search functionality. "," Lack of geospatial search functionality might limit the usability of Elasticsearch and reduce its appeal to users who need this feature."," The owner acknowledged the request and stated the geospatial search feature will be closely integrated in future updates, likely in version 0.6.0. "," The issue was closed, with the owner promising to add an issue titled ""Spatial Support"" later on, indicating a commitment to addressing the problem in the future."
elasticsearch,elastic,5," The user queries about the availability of faceted searching in elasticsearch, which is not currently fully implemented."," Lack of a key feature (faceted search) in Elasticsearch may reduce its appeal to potential users."," The owner acknowledges that basic support for facet queries exists, while other types are planned for future implementation. Decided to close the issue and create separate issues for each new facet support planned."," No preventative measure discussed. Future discussions about feature implementation will be carried out in separate issues."
elasticsearch,elastic,6," The Bool query/filter is not a valid JavaScript, and uses the same field name twice which makes it invalid JSON as well."," It may cause issues with JSON parsers and systems that are strict with JSON standards, potentially causing incorrect query results or application errors."," The suggestion is to provide a solution for repeatable items in a way that complies with JSON standards, i.e., { key: value } { keys: [ value_1, value_n ] }."," The team will ensure that future implementations uphold the JSON standards (i.e., unique key names)."
elasticsearch,elastic,7," The project was using an outdated version of JGroups (2.8.0) instead of the latest release (2.9.0)."," Using an outdated version of JGroups could lead to bugs, security vulnerabilities, and missed enhancements or improvements."," The project was upgraded to use the latest JGroups release (2.9.0)."," Regularly update all components and libraries used in the project to their latest versions to avoid similar issues."
elasticsearch,elastic,8," The Elasticsearch Rest API does not support receiving HTTP chunks. "," Large messages from certain HTTP clients that chunk the requests may not be properly processed. "," The issue was addressed and closed by the commit 5ac51ee93feab6c75fcbe979b9bb338962622c2e, which enabled support for chunked HTTP messages."," To prevent similar problems, it is recommended to ensure all potential data formats and transmission methods are considered and supported in future updates."
elasticsearch,elastic,10," The user cannot determine if a node has http enabled, limiting the ability to spread the load between nodes or connect to alternative nodes if one goes down. "," Without this feature, the project's performance and reliability can be negatively impacted, as load distribution and fault tolerance are not optimized."," The creator agreed to the enhancement and included it as part of the admin cluster node info API. The JSON now includes a section that shows if http is enabled or not for each node. "," The creator has added a parameter to include node settings, which can be accessed via a specific URL, thus enabling users to easily see and manage these settings in the future."
elasticsearch,elastic,12," The mapping API is not automatically creating indices in Elasticsearch 1.4.4."," This could affect users' ability to properly use the mapping API, impacting overall functionality."," The issue was initially fixed 5 years ago, but there was a later indication of a potential recurrence. The user was directed to the Elasticsearch mailing group for further support."," No specific preventative measures were mentioned, though user engagement on the Elasticsearch mailing group could help in identifying and addressing recurring issues."
elasticsearch,elastic,14," The Flush API was missing a refresh flag to control if a refresh will be done after a flush."," Without this feature, users cannot control the refresh behavior after a flush which could potentially affect application performance."," A refresh flag was added to the Flush API which defaults to false (meaning no refresh will be done after flush)."," N/A in this case as it was a feature enhancement."
elasticsearch,elastic,15," The Optimize API is missing parameters onlyExpungeDeletes, flush and refresh. "," Reduced optimization and configurability of the system."," Added onlyExpungeDeletes, flush and refresh parameters to the Optimize API."," Regular updates and checks for missing parameters in the API."
elasticsearch,elastic,16," The Search API did not accept /_search URI to search over all indices."," Limited functionality and usability of the Search API, potentially leading to less efficient data retrieval."," Updated the Search API to accept /_search URI for searching over all indices."," No specific preventative measure mentioned as it was a feature enhancement."
elasticsearch,elastic,17," Count API did not accept /_count URI to search over all indices."," Limited search functionality could slow down or complicate queries over all indices."," Implemented enhancement to accept /_count URI to search over all indices."," No specific preventative measures mentioned as this issue was about introducing a new enhancement, not fixing a recurring bug."
elasticsearch,elastic,18," Documentation error in object type mapping JSON where 'type = ""object""' should be 'type: ""object""'."," Incorrect documentation could lead to misunderstanding and improper usage of the feature by users."," The error was corrected in the documentation."," N/A."
elasticsearch,elastic,19," The 'flush_index' function in Elasticsearch hangs and eventually closes the connection when no indices exist. "," This issue can disrupt the flow of data in the Elasticsearch system and potentially crash the service."," The bug was fixed and the fix was confirmed with commit 1299f203645d1b4b72abfedc1d65991b05042361."," The details of the preventative measures weren't specified in the issue discussion, but it's likely that new checks were added to ensure indices exist before calling 'flush_index'."
elasticsearch,elastic,20," The #flush_index function in Elasticsearch returns both success and failure results simultaneously."," This might cause confusion for users and may hinder debugging if there are actual failures in the system."," The issue was clarified that the ""failures"" refer to shards that haven't been started yet. Further, updates were made to include explicit failure reasons in the responses."," By providing explicit failure reasons in the response, users will now have better understanding of the process and potential issues."
interviews,kdn251,3," The example graph for the Big O Notation in the interviews repository is incorrect."," This misinformation can lead to confusion or misunderstanding for those using the repository as a resource."," The owner must update the graph to correctly reflect the relationship between C*g(n) and f(n)."," Proper reviewing and fact-checking of information before publishing can prevent such errors in the future."
interviews,kdn251,5," The kth bit toggle operation was incorrectly written as ""s ^= ~(1 << k)"" instead of ""s ^= (1 << k)"" and the use of a temporary variable in the sequence ""t = x; x = y; y = t;"" is not recommended. "," The error in the bit toggle operation can cause inaccurate results and the use of temporary variable could lead to inefficient code. "," The bit toggle operation was corrected to ""s ^= (1 << k)"" and the code was changed to use 3 separate statements instead of a temporary variable. "," To prevent this issue, the project owner has taken feedback from the contributors into account and made necessary changes in the code."
interviews,kdn251,10," Incorrect complexity of remove min/max operation in a heap was stated in the project as O(1) instead of O(log(n))."," This can cause misunderstanding or confusion for those using the project, potentially leading to inefficiencies in code."," The owner thanked for the feedback and committed to correct the complexity of the operation in the documentation to O(log(n))."," A more thorough review or understanding of data structures and their operations' complexities could prevent such issues in the future."
interviews,kdn251,12," User requests permission to translate repository documentation into Chinese."," Potential misunderstanding or mistranslation may alter the intended meaning of the documentation."," The owner agreed and asked the user to open a Pull Request when the translation is complete."," The owner reviews and approves the translated document before it is shared, to ensure accuracy."
interviews,kdn251,15," The project is missing a Dynamic/Memoization feature."," The project may lack optimization and efficiency without this feature."," The owner, kdn251, took responsibility to add the missing feature."," No explicit preventative measure was discussed in the conversation."
interviews,kdn251,35," The ""readme.md"" file did not contain direct links to the code in the directory tree."," Navigation to the necessary code files may be difficult for users, decreasing user-friendliness and accessibility."," A pull request (PR) was made to add relative links to the code in the ""readme.md"" file."," Continual review and user feedback will aid in identifying and addressing any similar issues promptly in the future."
interviews,kdn251,44," The issue involves incorrect time complexities for Heap operations in the README file."," This could mislead users or learners of the repository who are trying to understand Heap operations."," The time complexities have been corrected through a pull request by yangshun."," The issue thread served as a learning experience to ensure correct labelling and description of time complexities in future."
interviews,kdn251,46," UC Berkley removed all their online lecture videos, causing the link for the UC Berkley Data Structures lecture to be broken."," Users are unable to access the UC Berkley Data Structures lecture, affecting the utility and completeness of the repository."," The broken link was replaced with an alternative link which contains all of the removed videos on archive.org."," No specific preventative action taken as this is an external issue. However, regular link checks and updates can be implemented to ensure all resources are accessible."
interviews,kdn251,63," The project did not specify a license."," Without a clear license, potential contributors and users may be unsure of their rights and obligations, which could limit the project's growth and usage."," The project owner added a license."," No clear preventative action was mentioned, but ensuring to specify a license at the project's onset could prevent similar issues in the future."
interviews,kdn251,106," User wants to know if they can fork and translate the project into Korean."," Potential miscommunication or misunderstanding due to language barriers."," Allow the user to fork and translate the project into Korean."," Establish a clear process for translation requests and contributions to the project."
