repo,owner,issue,problem,risks,resolution,preventative
JavaGuide,Snailclimb,1," Users discuss several issues related to the documentation of the JavaGuide project, including errors, improvement suggestions, and requests for content to be added. "," Potential inaccuracies and incomplete documentation could confuse or mislead users, affecting the project's quality and reputation."," The project owner responded to users' comments, made clarifications, and committed to making improvements when time allows."," Encouraging user feedback, the project owner can stay aware of any issues or inaccuracies in the documentation and make necessary adjustments or additions."
JavaGuide,Snailclimb,2," The user's forked repository is missing some files because it's not synchronized with the original repository."," This could lead to outdated or incomplete code for any developers who fork the repository."," The original repository owner advised the user to either re-fork or synchronize their repository. Another user provided a specific git command for synchronizing updates."," Users who fork repositories should frequently check for updates in the original repository and synchronize as needed."
JavaGuide,Snailclimb,7," Unclear understanding of the basis for TREEIFY_THRESHOLD and UNTREEIFY_THRESHOLD values in HashMap operations in Java."," Inefficient use and understanding of HashMap operations could lead to improper data management and performance issues."," Explained that the value of 8 (for TREEIFY_THRESHOLD) is chosen based on Poisson distribution and it's the lowest threshold for HashMap operations to maintain optimal time complexity, while the bucket becomes a linked list when the node count is less than UNTREEIFY_THRESHOLD. "," Encouraged to read and understand the source code thoroughly to better comprehend these threshold values and how they affect data structures and operations."
JavaGuide,Snailclimb,8," Typographical error in the JavaGuide project documentation."," Confusion or misunderstanding for users trying to understand the guide."," Corrected the typographical error in the documentation."," Implement a proofreading process before publishing documentation updates."
JavaGuide,Snailclimb,9," The project's typography needs to be standardized. "," If not addressed, this could lead to readability issues and inconsistent presentation across the project."," The project owner Snailclimb acknowledged the issue and committed to improving it. "," Future project updates will follow standard typography rules to maintain consistency."
JavaGuide,Snailclimb,12," There is a misunderstanding or confusion in the JavaGuide repository about the concept of value transfer and reference transfer in Java."," Misunderstanding of these core concepts could potentially lead to incorrect usage, causing bugs or inefficient code."," After extensive discussions and examples, it was clarified that Java always uses call by value. Even though the method receives a copy of all parameter values, it does not mean Java does not have reference transfer. The method can change the state of an object parameter but cannot let an object parameter refer to a new object."," Future confusion can be prevented by correctly documenting and teaching these core concepts in JavaGuide."
JavaGuide,Snailclimb,13," The user has found several inaccuracies in the explanation of HashMap operation in the Java Guide, including the hashing process, resolving conflicts and the time complexity of various operations."," The risk is misinformation being spread among users who refer to the guide, leading to potential errors in their understanding and application of Java and HashMap functionality."," The repository owner reviewed the inaccuracies pointed out, agreed with the user's suggestions, and updated the guide to accurately explain the functionality of HashMap."," The repository owner can ensure accurate information by periodically reviewing the guide, considering user suggestions, and updating the guide with correct information as necessary."
JavaGuide,Snailclimb,14," Typographical error found in the JavaGuide repository."," A typographical error can lead to misunderstandings and confusion for the users."," The error was corrected by the repository owner, Snailclimb."," The issue does not specify any preventative measures to avoid typographical errors in the future."
JavaGuide,Snailclimb,16," The document ""程序员的简历之道.md"" contains a lot of repetitive content."," User experience could be affected negatively due to poor content presentation."," The owner, Snailclimb, acknowledged the problem and has resolved it."," No specific preventative measures were mentioned."
JavaGuide,Snailclimb,19," Incorrect information about the byte space of character in Java in the JavaGuide repository."," Misinformation could lead to errors or inefficient coding by users of the guide."," Acknowledged and thanked for the correction from contributors."," None mentioned."
JavaGuide,Snailclimb,22," No problem indicated as this is a positive interaction between users."," No risks mentioned or evident."," No resolution needed."," No preventative measures needed."
JavaGuide,Snailclimb,25," The project description has a grammar issue."," This could lead to confusion and misinterpretation, which may deter potential contributors."," Unclear as the owner has asked for a more detailed description of the issue."," Ensure proper proofreading and language usage in future project descriptions to avoid grammatical errors."
JavaGuide,Snailclimb,26," The user catch6 is suggesting to have the content in gitbook format for easy export to mobi for Kindle reading."," The project might lose users who prefer to read content in a more portable format like on Kindle."," The project owner, Snailclimb, responded that they will consider it when they have more time and the content is more complete."," No specific preventative measure was mentioned. However, it can be inferred that they may consider exporting the content to gitbook in the future to cater to users' preferences."
JavaGuide,Snailclimb,28," The user suggested adding a Scrum article to the JavaGuide repo, but the provided link was broken."," Without the correct link, the useful Scrum resource cannot be added to the repo, limiting the project's comprehensiveness."," The user provided a new, working link to the suggested Scrum article."," No preventative actions were mentioned in the issue."
JavaGuide,Snailclimb,29," The user YuKongEr found some errors and misleading explanations in the code and documentation of the JavaGuide repository."," This may lead to confusion and misuse of the code by other users, potentially causing issues in their projects that use this code."," The repository owner, Snailclimb, acknowledged the issues and improved the documentation and code based on the suggestions."," The specific preventative measure is not mentioned in the provided context. However, regularly reviewing and updating documentation, and encouraging user feedback can help avoid such issues in the future."
JavaGuide,Snailclimb,32," The README of the repository does not contain any demo gifs."," The project may miss opportunities for wider exposure and user engagement as it's trending and can be featured on the ""github_trending_videos"" Instagram account. "," The owner needs to add a demo gif to the README file."," In the future, consider including demo gifs or other illustrative media in README files as part of the standard procedure for repository setup."
JavaGuide,Snailclimb,33," The issue does not contain any actual problem, it's a positive feedback from a user."," There are no associated risks as this is not a problem."," No action required as this is positive feedback."," No preventative action needed as this is not a problem."
JavaGuide,Snailclimb,35," Confusion about the purpose of the ensureCapacity method in ArrayList."," Misunderstanding of this method could lead to inefficient use of memory, poor performance, or incorrect program behavior."," Explanation given about how ensureCapacity method is used to increase the capacity of an ArrayList instance to ensure that it can accommodate at least the number of elements specified by the minimum capacity parameter."," Ongoing education and clarification about the use of different methods in Java."
react-native,facebook,2," The file `pthread.h` cannot be found in the specified location while building on OS X 10.9.3 targeting iOS SDK 7.1."," The project cannot be compiled and built on certain system configurations, potentially limiting its user base."," The import line in `/ReactKit/Modules/RCTUIManager.m` was updated from `#import <pthread/pthread.h>` to `#import <pthread.h>`."," Continually review and test the project on various system configurations to catch and fix these kinds of issues."
react-native,facebook,4," The user was unable to set the status bar to light in react-native on a dark background. "," The inability to set the status bar to light limits customization, potentially decreasing user satisfaction. "," The user ""amccloud"" implemented StatusBarIOS to set the status bar to light and pushed the changes to their fork. These changes were then merged into the main repository. "," Encouraging users to contribute and implement solutions to issues they encounter."
react-native,facebook,5," The simulator does not automatically refresh when a file is changed, requiring a manual Cmd-R each time."," This slows down development and testing, creating inefficiencies in the workflow."," Discussion was held around integrating webpack's Hot Module Replacement for auto-refresh, however performance issues, such as build times, were raised. A new SourceMaps for webpack was implemented to enhance performance."," A shift to react-native could be considered to enable better integration with webpack. Further work needs to be done to make source map devtool pluggable. Suggestions were also made to cache loader results for faster startup."
react-native,facebook,7," Lack of clear guidelines for exposing native APIs in React Native."," Potential for inconsistent or inefficient API usage; difficulty in maintaining and expanding the project."," Discussion on best practices and possibilities; closing the issue as it was more of a discussion and not an actionable issue."," Consideration of allowing users to create their own bindings via plugins, potentially also implementing an automatic option."
react-native,facebook,8," Lack of support for Webpack dev server in the React Native project."," This could potentially disrupt the workflow of developers who rely on transforms such as 6to5, and prevent the integration of Hot Module Replacement."," A suggestion was made to host files on localhost and work with the existing setup, but formal support for webpack-dev-server was not implemented."," Developers are encouraged to adapt to the existing setup, or reopen the issue if further help is needed with the react hot loader."
react-native,facebook,9," The error message displayed when a source file is not found is not descriptive enough."," Developers may waste time trying to decipher unclear error messages, slowing down the project development."," The issue was fixed to provide more descriptive error messages."," No specific preventative measure was mentioned, but clear and descriptive error messages should prevent similar issues in the future."
react-native,facebook,11," Exceptions in the render() function caused the app to crash and open in Xcode, requiring a restart."," Potential for frequent app crashes, disrupting user experience and development process."," Issue was resolved, though the specific action taken wasn't stated."," Not mentioned in the given content."
react-native,facebook,12," Running on device was not initially possible, causing a red error screen as the device couldn't find localhost."," This issue could prevent users from properly testing and using the React Native framework on their devices."," A solution was provided which involved either running the server on the user's computer and changing 'localhost' to their IP or using cURL to download and reference the file. Eventually, the issue was fixed by the team."," To prevent such issues, the team planned on implementing a build step that compiles the JS source into a resource file in the app bundle. Documentation was also suggested to guide users through similar issues."
react-native,facebook,14," XMLHttpRequest does not support response headers in the React-Native project, with `getAllResponseHeaders()` only acting as a stub and no implementation of `getResponseHeader`."," This could potentially inhibit any future development that requires response headers, potentially limiting functionality."," The issue was resolved with a pull request made by the issue reporter."," No specific preventative action mentioned, but regular checking and testing of new features could help identify such issues in the future."
react-native,facebook,16," Poor error message when user forgets to run 'npm install'."," User experience is affected, potentially leading to less adoption of the tool."," The error message was improved by detecting if the node_modules directory exists."," No specific preventative measure mentioned, but continuous enhancement of error messages can help in the future."
react-native,facebook,17," Uncertainty about the possibility of running React Native on WatchKit."," Limited application of React Native if it cannot run on WatchKit."," Provided a guide on how to potentially utilize WatchKit with React Native."," Understanding the limitations and requirements of WatchKit for future development."
react-native,facebook,20," npm start fails with ""Watcher took too long to load"" on the react-native package on a 2011 Mac laptop."," This could prevent developers from running the package, slowing down progress and testing."," The problem was a result of a conflict with a previously installed version of pcre, and was resolved by uninstalling and reinstalling node, pcre, and watchman."," While there isn't a specific preventative measure in place, the problem was deemed to be rare, as it would only occur if pcre had been manually installed without Homebrew. If similar issues arise again, deeper investigation will be conducted."
react-native,facebook,22," Uncertainty about sharing details and giving demos of the private React Native repo in a public talk."," Potential violation of intellectual property and premature exposure of features that are still in development."," Approval was given for the demo and discussion of what's inside the repo."," Future issues can be prevented by setting clear guidelines on the sharing of information related to private repos."
react-native,facebook,23," The user is struggling to run the packager for a new project in React Native and there are no clear instructions on how to set the project root."," This could impede onboarding new developers to the project and slow down the development process as developers need to figure out these issues themselves."," Temporary fixes involved hardcoding the project root into the packager and copying the node_modules directory into the new project. A better approach was suggested of using 'npm install react-native' + packages and running 'npm exec devserver' to start the packager. Additionally, comprehensive manual steps were shared on setting up a new project."," To avoid such issues in the future, there is a need to improve the project creation experience and provide clear documentation on creating new projects, as well as how to integrate with other bundlers like webpack."
react-native,facebook,24,,,,
react-native,facebook,25," The react-native GitHub repository has an issue where the layout of the page does not adjust appropriately when the orientation of the device changes."," This poses a significant risk to the user experience of any apps developed using react-native, as they will not display correctly on devices in landscape mode."," Users suggested various workarounds like handling onLayout events to cause a re-render, disabling the landscape orientation via configuration, and using inline styles instead of Dimensions.get in a StyleSheet. "," To prevent this issue from happening in future versions of the library, it is suggested to implement a mechanism within react-native that automatically adjusts the layout when the device orientation changes, rather than relying on the app developers to handle this functionality."
react-native,facebook,28," The user encountered an exception: ""[RCTRootView setReactTag:] unrecognized selector instance sent to instance"" while trying to integrate react-native into an existing project."," The issue could cause disruption in the integration process, potentially delaying the project."," The user managed to resolve the issue by adding `@executable_path/Frameworks` to the ""Runpath Search Paths""."," The user suggested documenting such small but crucial steps to avoid similar issues in the future."
java-design-patterns,iluwatar,4," The explanations for design patterns in the project are too theoretical and not practical enough for some users."," The learning resource may not be useful for users looking to apply design patterns in their day-to-day work, leading to less engagement."," The owner asked the users for contributions to provide more clear, practical explanations. "," Encourage more user participation and contribution to continually improve the quality of the explanations."
java-design-patterns,iluwatar,12," ThreadSafeLazyLoadedIvoryTower class in the Singleton pattern does not have a private constructor."," Without a private constructor, this can potentially compromise the thread-safety of the Singleton design pattern."," A private constructor was added to the ThreadSafeLazyLoadedIvoryTower class."," Ensure that classes designed as singletons are always implemented with a private constructor to maintain thread safety."
java-design-patterns,iluwatar,13," All diagrams were incorrectly linked to files from a fork, not the base repository."," This could potentially confuse users and misdirect them to an incorrect repository."," Fixed the images to point to the root repository."," Ensure that future modifications to file links point to the correct repository to prevent misdirection."
java-design-patterns,iluwatar,17,,,,
java-design-patterns,iluwatar,25," The issue is about the possibility of adding web application and database patterns to the project."," The risk could be the complexity or misrepresentation of the proposed patterns if not well implemented."," The project owner agrees to the suggestion, instructing the user to make a new category for them in the README.md and provide simple, well-commented code examples."," N/A. This is a suggestion for project enhancement, not an issue to be prevented."
java-design-patterns,iluwatar,28," User has a question about a file ending with ucls in a package and wants to know what software was used to create it."," Not applicable as this is a query, not a project risk."," The project owner clarified that the files are project files for ObjectAid UML Explorer for Eclipse and provided a link for more information."," Not applicable as this is a user question, not an issue that requires preventative measures."
java-design-patterns,iluwatar,34," The project needed an implementation of the Data Mapper Pattern."," Without this implementation, the project lacked a tried and tested way to map database tables without using any framework."," A user proposed an implementation of the Data Mapper Pattern and later made a pull request for review."," Ongoing communication and collaborative effort among users help identify gaps and needed enhancements in the project."
java-design-patterns,iluwatar,35," NullPointerException being thrown programmatically in HeroBuilder.java"," Decreased readability and improper use of exception handling in the code."," Replaced the NullPointerException with IllegalArgumentException as suggested."," Always ensure to use proper and more readable exceptions in the code, not programmatically thrown NullPointerExceptions."
java-design-patterns,iluwatar,38," User unsure of which UML drawing software was used for project."," Miscommunication or misunderstanding due to lack of knowledge on used tools."," Informed user about the UML drawing software (ObjectAid UML Explorer) used."," Encourage users to read the 'How to Contribute' section in README.md where used tools are mentioned."
java-design-patterns,iluwatar,40," User is asking for information about the software tool used to draw class diagrams."," Not directly a risk to the project, but might take up maintainers' time."," A project member responded with the relevant information."," No preventative measure taken as this is more of a query than a problem issue."
java-design-patterns,iluwatar,43," The Intercepting Filter example in the java-design-patterns repository needs improvements, such as changing the way filters are executed, improving the feedback mechanism, and transforming the data passed to the filters. "," The current implementation might limit the effectiveness and understanding of the design pattern, potentially leading to errors and inefficiencies in code development."," The issue was resolved by making the necessary changes as per the suggestions, including relocating the Intercepting Filter from presentation tier pattern."," No specific preventative measure was mentioned, but continuous review and improvements of the design patterns could help prevent such issues in the future."
java-design-patterns,iluwatar,45," The DAO (Data Access Object) design pattern is not included in the 'java-design-patterns' repository."," The project may lack comprehensive design solutions without the inclusion of the DAO pattern."," A contributor implemented the DAO design pattern and it was added to the repository with a commit."," Encouraged contributions from others to keep adding missing design patterns to the repository."
java-design-patterns,iluwatar,50," NullNode is not implemented as a singleton in the code. "," Code does not follow recommended design patterns, potentially leading to inefficient memory usage."," NullNode has been modified to follow singleton design pattern, as seen in the provided commit."," Future implementations should adhere to recommended design patterns."
java-design-patterns,iluwatar,55," The repository pattern was missing from the java-design-patterns project."," The project could lack important design pattern examples, reducing its value and usefulness."," The repository pattern was added to the project as suggested."," User feedback and suggestions are continually considered to ensure all relevant design patterns are included in the project."
java-design-patterns,iluwatar,56," The layout of the java-design-patterns project on GitHub was not user-friendly, with requests to improve this for better navigation and viewing. "," If the layout of the resource was not improved, it could result in decreased contributions and decreased usage due to poor user experience."," A project website was created using GitHub pages to improve the layout. This involved splitting up the README.md, creating a new theme, and incorporating new features such as tag/category search functionality and overview pages."," The team will continue to respond to user feedback to make further enhancements and ensure that the layout remains user-friendly."
java-design-patterns,iluwatar,57," The StarMemento exposes the internal state of Star object in memento patterns."," This could lead to potential security issues and violation of encapsulation principle."," The issue was fixed by making StarMemento an inner class of Star."," This particular issue can be avoided in the future by ensuring that internal states of objects are not exposed, adhering to the principle of encapsulation."
java-design-patterns,iluwatar,59," The project lacks code coverage analysis."," Without code coverage, there's an increased risk of unidentified bugs and decreased code quality."," The owner of the project, iluwatar, proposed using a Coveralls Maven plugin and made a series of requests to the all-contributors bot to add and update contributions."," No specific preventative measures were discussed in this issue, but the addition of code coverage analysis can help identify areas of code that are not tested and thus prevent future bugs."
java-design-patterns,iluwatar,60," The project lacks a static code analysis tool."," Potential for errors and bugs in the code, missed security vulnerabilities, and overall lower code quality."," A static code analysis tool (Coverity Scan) was added to the project."," Ensure all future projects incorporate static code analysis tools from the onset to maintain high code quality."
LeetCodeAnimation,MisterBooo,1," Not a problem, this issue is a discussion about how animations for the LeetCodeAnimation repository are made."," No risks identified."," The owner, MisterBooo, mentioned that they were created using PowerPoint, frame by frame, and plans to share a video tutorial about it in the future."," Not applicable."
LeetCodeAnimation,MisterBooo,2," The animation for reversing a string in the README (344) was incorrect."," Misleading information could confuse users and diminish the repo's reliability."," The owner of the repository corrected the error."," No specific preventative measures mentioned."
LeetCodeAnimation,MisterBooo,4," The issue content is not clear and lacks details of the problem."," Lack of clarity on the problem makes it hard to assess potential risks to the project."," No resolution action taken due to lack of problem clarity."," Encourage users to provide detailed information when raising issues."
